{
  "$schema": "https://json-schema.org/draft/2020-12/schema",
  "$id": "completion-obligations-surface-slice-input.schema.json",
  "title": "Completion obligations surface slice input",
  "description": "Derived boundary contract for the completion-obligations surface slice.",
  "type": "object",
  "required": [
    "kind",
    "control_object_id",
    "source_module_id",
    "source_module_ref",
    "export_schema_ref",
    "generator_ref",
    "projection_ref",
    "output_path",
    "overall_status",
    "obligation_groups",
    "render_contract"
  ],
  "properties": {
    "kind": {
      "const": "kernel.completion_obligations_surface.slice_input"
    },
    "control_object_id": {
      "const": "completion-obligations-surface-slice"
    },
    "source_module_id": {
      "const": "completion-obligations-surface-slice"
    },
    "source_module_ref": {
      "const": "structures/core/completion-obligations-surface-slice.module.json"
    },
    "export_schema_ref": {
      "const": "schemas/exported/completion-obligations-surface-slice-input.schema.json"
    },
    "generator_ref": {
      "const": "manifests/generators/completion-obligations-surface-slice.generator.json"
    },
    "projection_ref": {
      "const": "manifests/projections/completion-obligations-surface-slice.projection.json"
    },
    "output_path": {
      "const": "generated/registries/completion-obligations.index.json"
    },
    "overall_status": {
      "type": "string",
      "enum": [
        "materialized",
        "partial"
      ]
    },
    "obligation_groups": {
      "type": "object",
      "required": [
        "invariants",
        "artifact_classes",
        "implementation_order",
        "completion_conditions",
        "toolchain_control"
      ],
      "properties": {
        "invariants": {
          "$ref": "#/$defs/group"
        },
        "artifact_classes": {
          "$ref": "#/$defs/group"
        },
        "implementation_order": {
          "$ref": "#/$defs/group"
        },
        "completion_conditions": {
          "$ref": "#/$defs/group"
        },
        "toolchain_control": {
          "$ref": "#/$defs/group"
        }
      },
      "additionalProperties": false
    },
    "render_contract": {
      "type": "object",
      "required": [
        "renderer",
        "runtime",
        "runtime_path",
        "input_class",
        "output_class"
      ],
      "properties": {
        "renderer": {
          "const": "jsonnet"
        },
        "runtime": {
          "type": "string"
        },
        "runtime_path": {
          "type": "string"
        },
        "input_class": {
          "const": "admitted_state"
        },
        "output_class": {
          "const": "registry"
        }
      },
      "additionalProperties": false
    }
  },
  "$defs": {
    "entry": {
      "type": "object",
      "required": [
        "id",
        "label",
        "status",
        "evidence_refs"
      ],
      "properties": {
        "id": {
          "type": "string"
        },
        "label": {
          "type": "string"
        },
        "status": {
          "type": "string",
          "enum": [
            "materialized",
            "partial"
          ]
        },
        "evidence_refs": {
          "type": "array",
          "items": {
            "type": "string"
          },
          "minItems": 1
        }
      },
      "additionalProperties": false
    },
    "group": {
      "type": "object",
      "required": [
        "status",
        "evidence_refs",
        "items"
      ],
      "properties": {
        "status": {
          "type": "string",
          "enum": [
            "materialized",
            "partial"
          ]
        },
        "evidence_refs": {
          "type": "array",
          "items": {
            "type": "string"
          },
          "minItems": 1
        },
        "items": {
          "type": "array",
          "minItems": 1,
          "items": {
            "$ref": "#/$defs/entry"
          }
        }
      },
      "additionalProperties": false
    }
  },
  "additionalProperties": false
}
